<?xml version="1.0" encoding="UTF-8"?>
<!DOCTYPE TEI SYSTEM "letterabellini.dtd">
<TEI xmlns="http://www.tei-c.org/ns/1.0">
    <teiHeader>
        <fileDesc>
            <titleStmt>
                <title>Lettera di Vincenzo Bellini a Carlo Pepoli</title>
                <author>Vincenzo Bellini</author>
                <respStmt>
                    <resp>Testo codificato da ms originale in TEI P5 a cura di</resp>
                    <name>William Brai</name>
                </respStmt>
            </titleStmt>
            <publicationStmt>
                <p>Testo codificato per esercizio</p>
                <publisher>Pastura<date when="1959">1959</date></publisher>
                <publisher>Neri<date when="2005">2005</date></publisher>
                <avalability status="restricted"><p>Opera riportata nelle slide del corso di codifica di testi</p></avalability>
            </publicationStmt>
            <sourceDesc>
                <bibl>
                    <title>Vincenzo Bellini a Carlo Pepoli</title>
                    <author>Vincenzo Bellini</author>
                    <pubPlace>Puteaux</pubPlace>
                    <date when="26/06/1834">26 giugno 1834</date>
                </bibl>
            </sourceDesc>
        </fileDesc>
        <encodingDesc>
            <p>Codifica in Tei versione P5 partendo un'immagine della lettera</p>
        </encodingDesc>
    </teiHeader>
    <text>
        <body>
            <div type="lettera">
                <opener>
                    <dateline lang ="FR">Juin <num>26</num><pc unit="Colon">:</pc> <placeName country="France">Puteau</placeName> <pc unit="Hyphen-minus">–</pc> <choice><abbr type="acronym">N</abbr><expan>N<ex>umero</ex></expan></choice><pc unit="Colon">:</pc><num type="ordinal">19</num> bis rampe <space dim="vertical"/><placeName rend="underline">de Neuilly</placeName></dateline>
                    <salute>Mio caro Car<damage agent="time">lu</damage>ccio</salute>
                </opener>
                <p>avendo steso l’intero <seg rend="Bold">duetto</seg></p>
            </div>
        </body>
    </text>
</TEI>